[
  {
    "id": "ent-99101",
    "prefabId": 0,
    "resourceName": "{0000000000000001}Prefabs/Vegetation/Trees/Tree_Pinus_M.et",
    "kind": "tree",
    "class": "conifer",
    "label": "Pine tree (medium)",
    "taxonomyPath": "vegetation/tree/conifer",
    "summary": "Medium conifer pine; soft cover to ~4 m standing.",
    "x": 5120.5,
    "y": 4800.0,
    "z": 138.2,
    "rotationDeg": 90,
    "spatial": { "model": "obb", "pivot": "base", "halfExtentsM": { "x": 1.2, "y": 1.2, "z": 6 }, "heightM": 12 },
    "gameplay": { "cover": { "type": "soft", "standing": true, "prone": true, "crouch": true, "heightM": 4 }, "movement": { "blocksInfantry": false, "blocksVehicle": false }, "lineOfSight": "partial", "destructible": true, "climbable": false, "enterable": false, "ladder": false, "door": false, "bridge": false, "runway": false },
    "placement": { "zDeltaM": 0.1, "severity": "ok", "visibleAboveGroundPct": 0.98, "maxBurialM": 0.0 },
    "tags": []
  },
  {
    "id": "ent-99102",
    "prefabId": 1,
    "resourceName": "{000000000000000A}Prefabs/Structures/Residential/House_Village_01.et",
    "kind": "building",
    "class": "residential",
    "label": "Village house",
    "taxonomyPath": "structure/building/residential",
    "summary": "Residential village house; hard cover; enterable.",
    "x": 5130.0,
    "y": 4810.0,
    "z": null,
    "rotationDeg": 0,
    "spatial": { "model": "obb", "pivot": "center", "halfExtentsM": { "x": 5, "y": 5, "z": 4 }, "heightM": 8, "footprintM2": 100 },
    "gameplay": { "cover": { "type": "hard", "standing": true, "prone": true, "crouch": true, "heightM": 2.5 }, "movement": { "blocksInfantry": true, "blocksVehicle": true }, "lineOfSight": "full", "destructible": true, "climbable": false, "enterable": true, "ladder": false, "door": true, "bridge": false, "runway": false },
    "tags": ["objective"]
  },
  {
    "id": "ent-99105",
    "prefabId": 29,
    "resourceName": "{000000000000001E}Prefabs/Rocks/Cliff_Granite_Face_L.et",
    "kind": "rock",
    "class": "cliff",
    "label": "Granite cliff face (large)",
    "taxonomyPath": "terrain/rock/cliff",
    "summary": "Large cliff face prop; hard cover; blocks movement and LOS completely.",
    "x": 2300.0,
    "y": 6100.0,
    "z": 210.4,
    "rotationDeg": 15,
    "spatial": { "model": "obb", "pivot": "base", "halfExtentsM": { "x": 6, "y": 3, "z": 8 }, "heightM": 16 },
    "gameplay": { "cover": { "type": "hard", "standing": true, "prone": true, "crouch": true, "heightM": 16 }, "movement": { "blocksInfantry": true, "blocksVehicle": true }, "lineOfSight": "full", "destructible": false, "climbable": false, "enterable": false, "ladder": false, "door": false, "bridge": false, "runway": false },
    "placement": { "zDeltaM": -0.3, "severity": "ok", "visibleAboveGroundPct": 0.96, "maxBurialM": 0.3 },
    "tags": []
  },
  {
    "id": "ent-99106",
    "prefabId": 39,
    "resourceName": "{0000000000000028}Prefabs/Structures/Utility/StreetLamp_Metal_01.et",
    "kind": "utility",
    "class": "lamp",
    "label": "Street lamp (metal)",
    "taxonomyPath": "infrastructure/utility/lamp",
    "summary": "Metal street lamp; tall thin pole; night light source; no real cover.",
    "x": 5160.0,
    "y": 4790.0,
    "z": null,
    "rotationDeg": 0,
    "spatial": { "model": "obb", "pivot": "base", "halfExtentsM": { "x": 0.2, "y": 0.2, "z": 3 }, "heightM": 6 },
    "gameplay": { "cover": { "type": "soft", "standing": true, "prone": false, "crouch": false, "heightM": 0.2 }, "movement": { "blocksInfantry": false, "blocksVehicle": false }, "lineOfSight": "partial", "destructible": true, "climbable": false, "enterable": false, "ladder": false, "door": false, "bridge": false, "runway": false },
    "tags": []
  }
]
